{
  "session_id": "sess_reply_002",
  "snapshot_seq": 12,
  "digest": "sha256:143526e3a9ad9ef174feb1dbc6d8bce3c04c97c6328df14e20d5b8042493c237",
  "last_applied_seq": 12,
  "turn_state": "Completed",
  "turn_id": "turn_002",
  "host_connectivity": "Online",
  "client_freshness": "Live",
  "state_summary": {
    "session_status": "active",
    "active_turn": null,
    "active_permission": null,
    "diff_file_count": 1,
    "test_status": null,
    "tool_states": [
      {
        "tool_name": "grep",
        "status": "Completed"
      },
      {
        "tool_name": "edit",
        "status": "Completed"
      }
    ]
  },
  "created_at": "2026-08-17T11:00:17Z",
  "version": "1.0.0"
}
