{
  "session_id": "sess_unknown_008",
  "snapshot_seq": 7,
  "digest": "sha256:095f1efa581a4b466d72bcedbdbf098691dead30d4fddf3dd6e805a5d4ee7ba6",
  "last_applied_seq": 7,
  "turn_state": "OutcomeUnknown",
  "turn_id": "turn_001",
  "host_connectivity": "Online",
  "client_freshness": "Live",
  "state_summary": {
    "session_status": "active",
    "active_turn": "turn_001",
    "active_permission": null,
    "diff_file_count": 1,
    "test_status": null,
    "tool_states": [
      {
        "tool_name": "edit",
        "status": "Completed"
      },
      {
        "tool_name": "run_tests",
        "status": "Failed"
      }
    ]
  },
  "created_at": "2026-08-17T17:00:30Z",
  "version": "1.0.0"
}
