{
  "session_id": "sess_interrupt_009",
  "snapshot_seq": 8,
  "digest": "sha256:c74049c4c79f11eba7be1c22e858c40940d69a585e6b121e8264ece2771196b1",
  "last_applied_seq": 8,
  "turn_state": "Running",
  "turn_id": "turn_new",
  "host_connectivity": "Online",
  "client_freshness": "Live",
  "state_summary": {
    "session_status": "active",
    "active_turn": "turn_new",
    "active_permission": null,
    "diff_file_count": 0,
    "test_status": null,
    "tool_states": [
      {
        "tool_name": "grep",
        "status": "Failed"
      }
    ]
  },
  "created_at": "2026-08-17T18:00:07Z",
  "version": "1.0.0"
}
