{
  "session_id": "sess_stop_003",
  "snapshot_seq": 8,
  "digest": "sha256:9f4c772078dd3ac6d4567dd32c5cf50ee4ad0c3e78ff12907db3cf75572acf34",
  "last_applied_seq": 8,
  "turn_state": "Cancelled",
  "turn_id": "turn_001",
  "host_connectivity": "Online",
  "client_freshness": "Live",
  "state_summary": {
    "session_status": "active",
    "active_turn": null,
    "active_permission": null,
    "diff_file_count": 0,
    "test_status": null,
    "tool_states": [
      {
        "tool_name": "grep",
        "status": "Completed"
      },
      {
        "tool_name": "edit",
        "status": "Failed"
      }
    ]
  },
  "created_at": "2026-08-17T12:00:07Z",
  "version": "1.0.0"
}
